,Unnamed: 0,title,short_description,institution,subject,price,length,effort,level,prerequisites,course_link
286,286,Evidence-Based Technology Management,Recognize the value of your data and leverage information assets to achieve business objectives using evidence-based practices.,ANUx,Business & Management,FREE,6 weeks,8-10 hours per week,Intermediate,Students are required to have completed EBM01x. This course is a graduate level course that assumes an undergraduate degree level understanding in a non-cognate area.,https://www.edx.org/course/evidence-based-technology-management-anux-ebm06x
287,287,Introduction to Bioethics,"Introduction to Bioethics explores some of the most difficult - and fascinating - moral challenges we face in health, medicine, and emerging technologies.",GeorgetownX,Biology & Life Sciences,FREE,10 weeks,3-5 hours per week,Introductory,,https://www.edx.org/course/introduction-bioethics-georgetownx-phlx-101x
288,288,Introduction to German Opera,Explore German Opera as we learn to listen to music in new ways.,DartmouthX,Music,FREE,4 weeks,3-4 hours per week,Introductory,None,https://www.edx.org/course/introduction-german-opera-dartmouthx-dart-mus-02x
289,289,Product Design: The Delft Design Approach,Learn to design meaningful products and services in this introductory design course.,DelftX,Design,FREE,7 weeks,6-8 hours per week,Intermediate,,https://www.edx.org/course/product-design-delft-design-approach-delftx-dda691x-2
290,290,Solar Energy: Photovoltaic (PV) Energy Conversion,Understand how solar cells generate electricity. Learn about semiconductor physics and optics required to design and manufacture solar cells.,DelftX,Engineering,FREE,11 weeks,10 hours per week,Advanced,BachelorÛªs degree in Science or Engineering or the successful completion of TU DelftÛªs MOOC Solar Energy.,https://www.edx.org/course/solar-energy-photovoltaic-pv-energy-delftx-pv1x-0
291,291,Framing: How Politicians Debate,The game of framing and reframing. Analyze how politicians debate and what the underlying patterns are in the game of framing and reframing.,DelftX,Communication,FREE,6 weeks,2-4 hours per week,Introductory,None,https://www.edx.org/course/framing-how-politicians-debate-delftx-frame101x-0
292,292,Basic Spanish 1: Getting Started,"Learn Spanish and explore Spanish culture in this introductory language course, designed for English speakers.",UPValenciaX,Education & Teacher Training,FREE,7 weeks,4 hours per week,Introductory,None,https://www.edx.org/course/basic-spanish-1-getting-started-upvalenciax-bsp101x
293,293,The Entrepreneurial Mindset,Uncover the secrets of thinking like an entrepreneur to create value for stakeholders and society across a variety of business settings.,BabsonX,Business & Management,FREE,4 weeks,4-6 hours per week,Introductory,None,https://www.edx.org/course/entrepreneurial-mindset-babsonx-bpet-etax-0
294,294,Analytics for the Classroom Teacher,This course is ideal for school teachers who want to improve their teaching through valuable data-driven insights.,CurtinX,Education & Teacher Training,FREE,6 weeks,4 hour per week,Introductory,None,https://www.edx.org/course/analytics-classroom-teacher-curtinx-edu1x-0
295,295,Introduction to Project Management,Learn the principles of project management and apply them in your own work and life.,AdelaideX,Business & Management,FREE,6 weeks,2-3 hours per week,Introductory,None,https://www.edx.org/course/introduction-project-management-adelaidex-project101x-1
296,296,Introduction to Astrophysics,Learn about the physical phenomena at play in astronomical objects and link theoretical predictions to observations.,EPFLx,Science,FREE,7 weeks,2-4 hours per week,Introductory,,https://www.edx.org/course/introduction-astrophysics-epflx-phys-209-enx
297,297,Introduction to Statistical Methods for Gene Mapping,Learn about statistical methods used to identify genetic variants responsible for phenotypes.,KyotoUx,Data Analysis & Statistics,FREE,4 weeks,2-3 hours per week,Advanced,,https://www.edx.org/course/introduction-statistical-methods-gene-kyotoux-005x-1
298,298,Introduction to jQuery,"This course will teach you how to use jQuery to simplify common tasks in JavaScript, allowing the you to quickly add interactivity to web pages.",Microsoft,Computer Science,FREE,3 weeks,3-4 hours per week,Intermediate,,https://www.edx.org/course/introduction-jquery-microsoft-dev208x-2
299,299,The Chemistry of Life,Learn how to generate ideas at the interface between chemistry and biology.,KyotoUx,Biology & Life Sciences,FREE,13 weeks,3 hours per week,Introductory,,https://www.edx.org/course/chemistry-life-kyotoux-001x-2
300,300,Culture of Services: New Perspective on Customer Relations,Learn how to analyze and understand the difficult dynamics of customer service. ,KyotoUx,Business & Management,FREE,8 weeks,2-3 hours per week,Introductory,None. This course is designed for undergraduate and graduate students who are interested in services.,https://www.edx.org/course/culture-services-new-perspective-kyotoux-002x-1
301,301,Advanced CSS Concepts,Gain a solid foundation in developing and testing device-friendly websites using the power of CSS.,Microsoft,Computer Science,FREE,4 weeks,3 hours per week,Intermediate,,https://www.edx.org/course/advanced-css-concepts-microsoft-dev218x-0
302,302,AngularJS: Framework Fundamentals,"Begin programming with AngularJS, a complete JavaScript-based open-source client and server-side web application framework that allows you to use HTML as your template language.",Microsoft,Computer Science,FREE,5 weeks,2-3 hours per week,Intermediate,,https://www.edx.org/course/angularjs-framework-fundamentals-microsoft-dev220x-0
303,303,Using Open Source Web Tooling to Improve Development Proficiency,"Learn how to use current open source tools such as Node.js , Boostrap, Font Awesome and the NPM to improve your web development proficiency.",Microsoft,Computer Science,FREE,5 weeks,3-5 hours per week,Intermediate,,https://www.edx.org/course/using-open-source-web-tooling-improve-microsoft-dev222x-0
304,304,Introduction to DevOps,Learn how to make your application lifecycle faster and more predictable for both developers and the operations team.,Microsoft,Computer Science,FREE,4 weeks,2-3 hours per week,Introductory,,https://www.edx.org/course/introduction-devops-microsoft-dev212x-2
305,305,Introduction to HTML and JavaScript,"Learn the essential skills to create an interactive web application using HTML5, JavaScript.",Microsoft,Computer Science,FREE,5 weeks,2-3 hours per week,Introductory,Some light experience with software development is helpful but not necessary.,https://www.edx.org/course/introduction-html-javascript-microsoft-dev211-1x-1
306,306,Introduction to Bootstrap ÛÒ A Tutorial,Learn how to use Bootstrap to implement mobile first web pages with CSS and JavaScript.,Microsoft,Computer Science,FREE,3 weeks,1-2 hours per week,Intermediate,,https://www.edx.org/course/introduction-bootstrap-tutorial-microsoft-dev203x-2
307,307,From Goddard to Apollo ÛÒ Part 1: The RocketsÛª Red Glare,Explore rocket science from ancient Chinese weaponry to NASAÛªs race to get a man on the moon. ,IEEEx,History,FREE,4 weeks,1 hour per week,Introductory,None,https://www.edx.org/course/goddard-apollo-part-1-rockets-red-glare-ieeex-atg1-x
308,308,Innovation and Competition: Succeeding through Global Standards,Learn how technical standards are key to product innovation and business success.,IEEEx,Engineering,FREE,6 weeks,Total Effort: 12-18 hours,Introductory,Missing,https://www.edx.org/course/innovation-competition-succeeding-ieeex-standards01-x-1
309,309,Trasplante de Ì_rganos - desafÌ_os Ì©ticos y jurÌ_dicos | Organ Transplantation - Ethical and Legal Challenges,En este curso analizaremos algunos interrogantes Ì©ticos y jurÌ_dicos que suscita el trasplante de Ì_rganos. In this course we will assess the ethical and legal challenges posed by organ transplantation.,UAMx,Law,FREE,9 weeks,4-6 hours per week,Intermediate,None,https://www.edx.org/course/trasplante-de-organos-desafios-eticos-y-uamx-txetj201x-2
310,310,Biobased Processes and Implementation,"Discover how to use microorganisms and catalysts to create biobased products, and then learn how to market and sell those products in a profitable business model.",WageningenX,Environmental Studies,FREE,8 weeks,100 hours,Intermediate,"BSc in technology, engineering (and applied) sciences. You should have at least BSc level knowledge on courses and topics such as chemistry, mathematics and process engineering.",https://www.edx.org/course/biobased-processes-implementation-wageningenx-bb02x
311,311,Introduction to Clinical Psychology,"Learn about the principles underlying psychological therapy and the features and treatment of common mental disorders, including anxiety, depression and schizophrenia.",UQx,Social Sciences,FREE,7 weeks,1-2 hours per week,Introductory,None,https://www.edx.org/course/introduction-clinical-psychology-uqx-psyc1030-3x
312,312,Basic Mandarin Chinese ÛÒ Level 3,Advance your Mandarin Chinese by tackling different topics in dynamic scenarios with extensive vocabulary and compound sentence structures.,MandarinX,Language,FREE,6 weeks,4 hours per week,Intermediate,Previous knowledge of Mandarin Chinese,https://www.edx.org/course/basic-mandarin-chinese-level-3-mandarinx-mx103x-0
313,313,The Opioid Crisis in America,"Learn about the opioid epidemic in the United States, including information about treatment and recovery from opioid addiction.",HarvardX,Medicine,FREE,7 weeks,1-2 hours per week,Introductory,None,https://www.edx.org/course/opioid-crisis-america-harvardx-hhp100
314,314,Big Data Analytics,"Learn key technologies and techniques, including R and Hadoop, to analyse large-scale data sets to uncover valuable business information.",AdelaideX,Computer Science,FREE,10 weeks,8-10 hours per week,Introductory,None,https://www.edx.org/course/big-data-analytics-adelaidex-analysisx
315,315,Nuclear Reactor Physics Basics,Become familiar with nuclear reactor physics and understand what happens in the nuclear reactor core.,MEPhIx,Physics,FREE,6 weeks,3-4 hours per week,Intermediate,"Acquisition in math and general physics, basics of integration, first and second order differential equations, vector algebra, math analysis, basics of atomic physics.",https://www.edx.org/course/nuclear-reactor-physics-basics-mephix-mephi005x
316,316,Introduction to Linux,Never learned Linux? Want a refresh? Take this course free or get a verified certificate for $99! ,LinuxFoundationX,Computer Science,FREE,8 weeks,Most users will find that thoroughly covering the material will take anywhere from 40 to 60 hours,Introductory,,https://www.edx.org/course/introduction-linux-linuxfoundationx-lfs101x-1
317,317,Accounting Essentials for MBA Success,An introduction to the financial and management accounting skills needed to succeed in both MBA study and in business.,ImperialX,Business & Management,FREE,6 weeks,3-4 hours per week,Introductory,Secondary school (high school) maths,https://www.edx.org/course/accounting-essentials-mba-success-imperialx-icbs001
318,318,Maths Essentials for MBA Success,"Discover and acquire the fundamental maths skills that you will need to use while studying an MBA program, from algebra to differentiation and geometric series.",ImperialX,Business & Management,FREE,6 weeks,2-3 hours per week,Introductory,Secondary school (high school) maths,https://www.edx.org/course/maths-essentials-mba-success-imperialx-icbs003
319,319,Biobased Sciences for Sustainability Capstone,"Use the skills and knowledge gained in the Biobased Sciences for Sustainability MicroMasters Program to design a sustainable biobased process and evaluate the technological, societal and economic impact.",WageningenX,Chemistry,FREE,8 weeks,15-20 hours per week,Advanced,"Successful completion of BB01x, BB02x, BB03x, BB04x and BB05x with a verified certificate for every course.",https://www.edx.org/course/biobased-sciences-sustainability-wageningenx-bb06x
320,320,Proteins: Biology's Workforce,Learn how the protein you eat keeps you alive and healthy by powering key functions from metabolism to DNA replication.,RiceX,Biology & Life Sciences,FREE,5 weeks,4-6 hours per week,Intermediate,Secondary (high school) chemistry and biology,https://www.edx.org/course/proteins-biologys-workforce-ricex-bioc300-1x-2
321,321,DNA: BiologyÛªs Genetic Code,DNA carries the defining data for life in a simple genetic code that comes with its own ÛÏback-upÛ system. Explore DNA structure with us! ,RiceX,Biology & Life Sciences,FREE,6 weeks,4-6 hours per week,Intermediate,High school chemistry and biology and BIOC300.1x OR understanding and knowledge of protein structure and function,https://www.edx.org/course/dna-biologys-genetic-code-ricex-bioc300-2x-1
322,322,Evaluating Designs with Users,"Learn how to design, run, and analyze usability tests to help improve user experience.",MichiganX,Design,FREE,4 weeks,3-4 hours per week,Intermediate,,https://www.edx.org/course/evaluating-designs-users-michiganx-ux504x
323,323,Introduction to Social Psychology,Learn why people think and behave the way they do in social settings.,UQx,Social Sciences,FREE,7 weeks,1-2 hours per week,Introductory,None,https://www.edx.org/course/introduction-social-psychology-uqx-psyc1030-1x
324,324,Sustainable Urban Development,Learn why cities are key in resolving global urbanization and sustainability challenges and how you can engineer tomorrowÛªs cities today. ,DelftX,Engineering,FREE,7 weeks,4-6 hours per week,Introductory,None,https://www.edx.org/course/sustainable-urban-development-delftx-wageningenx-ams-urb-1x
325,325,Solving Public Policy Problems: UC BerkeleyÛªs Eightfold Path,An introduction to BerkeleyÛªs signature method for problem-solving in the public interest.,UC BerkeleyX,Social Sciences,FREE,6 weeks,3-4 hours per week,Introductory,"Recommended: Secondary school course(s) on social studies/civics and/or undergraduate course introduction to government; Basic undergraduate course(s) in political economy and/or microeconomics, encompassing coverage of fundamentals of economic efficiency.",https://www.edx.org/course/solving-public-policy-problems-uc-uc-berkeleyx-policy01x-1
326,326,Islamic Finance and Capital Markets,"Learn about the structure, principles, instruments and challenges of Islamic finance and capital markets. ",IRTIx,Economics & Finance,FREE,4 weeks,3-4 hours per week,Introductory,None,https://www.edx.org/course/islamic-finance-capital-markets-irtix-ifcm101x-0
327,327,Mandarin Chinese for Business,Learn common Mandarin Chinese business phrases and understand Chinese culture so you can communicate professionally in the largest market in the world.,MandarinX,Language,FREE,6 weeks,4 hours per week,Intermediate,Missing,https://www.edx.org/course/mandarin-chinese-business-mandarinx-mx801x-0
328,328,Women Have Always Worked: The U.S. Experience 1700 ÛÒ 1920,"In Part One of Women Have Always Worked, learn how women's work has changed the home, the workplace, and the nation from the Colonial Period through World War I.",ColumbiaX,History,FREE,10 weeks,4-6 hours per week,Intermediate,"Recommended for those with undergraduate level interest in history, labor, and gender.",https://www.edx.org/course/women-have-always-worked-u-s-experience-columbiax-whaw1-1x
329,329,Video Game Asset Creation and Process,"Learn about the tools, processes and platforms that allow video game assets to be created and assembled into a commercial game.",RITx,Computer Science,FREE,5 weeks,3 hours per week,Introductory,None,https://www.edx.org/course/video-game-asset-creation-process-ritx-game103x
330,330,Fundamentals of Biomedical Imaging: Magnetic Resonance Imaging (MRI),"Learn about magnetic resonance, from the physical principles of Nuclear Magnetic Resonance (NMR) to the basic concepts of image reconstruction (MRI).",EPFLx,Physics,FREE,6 weeks,4-5 hours per week,Advanced,"It is recommended to have followed Biomedical Imaging: Ultrasounds, X-ray, positron emission tomography (PET) and applications. It is also recommended to have followed introductory physics at the Bachelor level and to be familiar with the concept of Fourier transformation.",https://www.edx.org/course/fundamentals-biomedical-imaging-magnetic-epflx-fndbioimg2x-0
331,331,"Fundamentals of Biomedical Imaging: Ultrasounds, X-ray, positron emission tomography (PET) and applications","Learn how principles of basic science are integrated into major biomedical imaging modalities and the different techniques used, such as X-ray computed tomography (CT), ultrasounds and positron emission tomography (PET).",EPFLx,Physics,FREE,7 weeks,4-5 hours per week,Advanced,It is recommended to have followed introductory physics at the Bachelor level and to be familiar with the concept of Fourier transformation.,https://www.edx.org/course/fundamentals-biomedical-imaging-epflx-fndbioimgx-0
332,332,Evidence-Based Project Management,"Learn which project management strategies, tools and techniques are most effective by analyzing evidence-based research.",ANUx,Business & Management,FREE,6 weeks,8-10 hours per week,Intermediate,Students are required to have completed EBM01x - Evidence Based Practice in Management. It is also recommended that students complete EBM06x ÛÒ Evidence Based Technology Management prior to taking this course. This course is a graduate level course that assumes an undergraduate degree level understanding in a non-cognate area.,https://www.edx.org/course/evidence-based-project-management-anux-ebm07x
333,333,Entrepreneurship in Emerging Economies,Explore how entrepreneurship and innovation tackle complex social problems in emerging economies.,HarvardX,Business & Management,FREE,6 weeks,3-5 hours per week,Introductory,None,https://www.edx.org/course/entrepreneurship-emerging-economies-harvardx-sw47x
334,334,Sensing Planet Earth ÛÒ From Core to Outer Space,Is the earth flat? Will this year be the hottest year ever? How fast is the rain forest disappearing? Û_ Learn about the crucial tools for measuring and monitoring our planet.,ChalmersX,Energy & Earth Sciences,FREE,5 weeks,6 hours per week,Introductory,None,https://www.edx.org/course/sensing-planet-earth-core-outer-space-chalmersx-chm003x-0
335,335,Understanding Nuclear Energy,Learn the science and technology behind nuclear energy and the special features of this energy source.,DelftX,Physics,FREE,6 weeks,4-6 hours per week,Intermediate,University level mathematics and physics,https://www.edx.org/course/understanding-nuclear-energy-delftx-nuclear01x-0
336,336,Creative Problem Solving and Decision Making,Learn how to solve complex problems with analysis based decision-making and solution designs.,DelftX,Business & Management,FREE,Missing,20-40 hours,Introductory,"None, apart from an open mind and the desire to discover new opportunities to get a firm grip on complex situations or a case you want to analyse.",https://www.edx.org/course/creative-problem-solving-decision-making-delftx-tpm1x-1
337,337,The Value of Business Models,Learn the value of business models and essential tools to help you develop a sound business model for sustainable success.,DelftX,Business & Management,FREE,6 weeks,2-4 hours per week,Introductory,Secondary school; basic notions about business and/or practical business experience,https://www.edx.org/course/value-business-models-delftx-bmi-1x-0
338,338,The Architectural Imagination,Learn fundamental principles of architecture ÛÓ as an academic subject or a professional career ÛÓ from a study of historyÛªs important buildings.,HarvardX,Architecture,FREE,10 weeks,3-5 hours per week,Introductory,None,https://www.edx.org/course/architectural-imagination-harvardx-gsd1x
339,339,Vacuum Systems and Technology,Learn the principles of vacuum systems and their applications in modern technologies.,MEPhIx,Engineering,FREE,3 weeks,2 hours per week,Intermediate,Knowledge of general physics,https://www.edx.org/course/vacuum-systems-technology-mephix-mephi004x
340,340,Dynamics and Control,"This is an interactive course about the basic concepts of Systems, Control and their impact in all the human activities.",UPValenciaX,Engineering,FREE,6 weeks,4 hours per week,Introductory,In this course the generic concepts of operators and relationships between variables are used but maths are avoided as much as possible. A basic knowledge of physics will help but it is not mandatory.,https://www.edx.org/course/dynamics-control-upvalenciax-dc201x-2
341,341,"Anatomy: Gastrointestinal, Reproductive and Endocrine Systems","Study the gastrointestinal, reproductive and endocrine systems to learn the primary functions of each and how they relate to the human body.",MichiganX,Biology & Life Sciences,FREE,5 weeks,2-3 hours per week,Introductory,Basic biology,https://www.edx.org/course/anatomy-gastrointestinal-reproductive-michiganx-anatomy403-4x
342,342,Foundations of Data Structures,Learn the best way to structure and represent data.,IITBombayX,Computer Science,FREE,6 weeks,8 hours per week,Intermediate,"Knowledge of programming concepts, as covered in Û÷Basic ProgrammingÛª course is necessary.",https://www.edx.org/course/foundations-data-structures-iitbombayx-cs213-1x-0
343,343,Implementation of Data Structures,"Learn how to write correct and efficient data structures manipulation using existing standard template library (STL) of C++. Get introduced to the power of STL and make your code more solid, reusable, and robust.",IITBombayX,Computer Science,FREE,6 weeks,8 hours per week,Intermediate,Concepts as covered in Object-Oriented Programming course and Foundations of Data Structures course.,https://www.edx.org/course/implementation-data-structures-iitbombayx-cs213-2x-0
344,344,Algorithms,Learn how to structure and use algorithms to solve real life problems.,IITBombayX,Computer Science,FREE,6 weeks,8 hours per week,Intermediate,Concepts of data structures as covered in Û÷Foundations of Data StructuresÛª and Û÷Implementation of Data StructuresÛª courses.,https://www.edx.org/course/algorithms-iitbombayx-cs213-3x-0
345,345,Programming Basics,Learn basic computer programming skills and master the art of writing C/C++ programs to solve real world problems.,IITBombayX,Computer Science,FREE,9 weeks,8 hours per week,Introductory,,https://www.edx.org/course/programming-basics-iitbombayx-cs101-1x-1
346,346,Object-Oriented Programming,Learn the principles of programming for building large and extensible systems.,IITBombayX,Computer Science,FREE,4 weeks,8 hours per week,Introductory,,https://www.edx.org/course/object-oriented-programming-iitbombayx-cs101-2x-0
347,347,"Writing, Presenting and Submitting Scientific Papers in English | Ü±¾Ðà¤Ô¾_Û¨¼¾Ðà ª_Ïü___¾Ïø¾_´Ô_","Learn how to properly write a scientific paper, based on international standards, and effectively make a presentation to submit proposals for funding. Á¬__ü_¼_¾µ¾÷ø¾ÜÓ¡ÐöÝ¾Ð¡¤Ô¾_Û¼¼¾ä¾ÏÛà__ãÈ_öÄ__ÝÛâÙ_ÉÈÜ±¾Ðà¤Ô¾_Û¨¼¾Ðà ª_Ïü___¾Ïø¾_´Ô__ãÄ__Ý_Îü¨_©_Ê¾äÒ_ÛüÐ¥Î¤ÔÝ_¤Ñ¬_Îü_Ý_ªÉÎÁÎ___ä¼_¾µÛâ    ",TsinghuaX,Communication,FREE,5 weeks,3 hours per week,Intermediate,College English and preliminary research training,https://www.edx.org/course/writing-presenting-submitting-scientific-tsinghuax-60250101
348,348,Introduction to Data Storage and Management Technologies,Learn the fundamentals of enterprise data storage and gain the skills to manage massive amounts of data with new technology.,IEEEx,Computer Science,FREE,4 weeks,1-2 hours per week,Intermediate,"Basic knowledge of computer architecture, operating systems, and computer networking is required.",https://www.edx.org/course/introduction-data-storage-management-ieeex-storage101x-0
349,349,A Hands-on Introduction to Engineering Simulations,Learn how to analyze real-world engineering problems using ANSYS simulation software and gain important professional skills sought by employers.,CornellX,Engineering,FREE,6 weeks,4-6 hours per week,Intermediate,,https://www.edx.org/course/hands-introduction-engineering-cornellx-engr2000x-0
350,350,Policy Analysis Using Interrupted Time Series,A comprehensive course on conducting and presenting policy evaluations using interrupted time series analysis. ,UBCx,Data Analysis & Statistics,FREE,5 weeks,6-10 hours per week,Intermediate,"Participants should have an understanding of linear regression, and familiarity with data handling in a major statistical package (R, SAS, SPSS, STATA, etc.). Course content is taught in the R statistical package, so familiarity with R / RStudio will be an asset.",https://www.edx.org/course/policy-analysis-using-interrupted-time-ubcx-itsx-2
351,351,Embedded Systems - Shape The World: Multi-Threaded Interfacing,"Build real-world embedded solutions using a bottom-up approach from simple to complex in this hands-on, lab-based course.",UTAustinX,Computer Science,FREE,8 weeks,10 hours per week,Intermediate,,https://www.edx.org/course/embedded-systems-shape-world-multi-utaustinx-ut-6-20x
352,352,Software Engineering: Introduction,"Learn how to apply engineering principles, such as Agile, to build a full-stack software system.",UBCx,Computer Science,FREE,6 weeks,8-10 hours per week,Advanced,,https://www.edx.org/course/software-engineering-introduction-ubcx-softeng1x
