,Unnamed: 0,title,short_description,institution,subject,price,length,effort,level,prerequisites,course_link
967,967,Business Accounting Basics,Learn the basics of the four financial statements to help analyze business investments and make profitable decisions.,PurdueX,Business & Management,FREE,5 weeks,3-5 hours per week,Introductory,Basic mathematical concepts; some algebra,https://www.edx.org/course/business-accounting-basics-purduex-pn-17-1
968,968,Personal Finance,"Manage your money more effectively by learning practical solutions to key investment, credit, insurance and retirement questions.",PurdueX,Economics & Finance,FREE,5 weeks,3-4 hours per week,Introductory,High school algebra; basic mathematical concepts,https://www.edx.org/course/personal-finance-purduex-pn-17-2
969,969,Communicating Strategically,"Improving communication skills and presentation effectiveness for scientists, engineers, and professionals.",PurdueX,Communication,FREE,5 weeks,4-6 hours per week,Introductory,None,https://www.edx.org/course/communicating-strategically-purduex-pn-17-3
970,970,Ignorance! | ¾ÑÊÙ´_,"A course about ignorance, what it is, where it comes from, what people do with it, its roles in society and culture, and how to deal with it. New expanded version. | Àª¾÷øüÛÑ¬É_¼_¾ÑÊÙ´_ãø_¬ÜÛâ¾ÑÊÙ´¾÷øÈÛ_ö_Ù¾ÑÊÙ´È__¥ÛÎ¾´_Ù¼¼ÈÂ¾Û_¾Êá_ã ¾ÑÊÙ´_Ù¾ÑÊÙ´Ï¬____ÕÎ¾ÐàÎÐü_¾ä¨¾_ÓÈÛ_ö¤Õä__Ù¾öÔÈÂø´_â_¥ø__É¾ÑÊÙ´_ÙÀª¾÷ø¾Ð¡äö¾ÏÂø_¬ÜÛâ",ANUx,Social Sciences,FREE,8 weeks,3-5 hours per week,Introductory,None,https://www.edx.org/course/ignorance-wu-zhi-anux-igno101x
971,971,A System View of Communications: From Signals to Packets (Part 1),"Explore the tradeoffs in designing communication systems like mobile phones, and the engineering tools to handle them.",HKUSTx,Computer Science,FREE,7 weeks,5 hours per week,Introductory,,https://www.edx.org/course/system-view-communications-signals-hkustx-elec1200-1x-2
972,972,AP Computer Science A: Java Programming Classes and Objects,"Learn about Java classes, objects, interfaces, and inheritance as you prepare for the AP Computer Science A exam.",PurdueX,Computer Science,FREE,6 weeks,4-6 hours per week,Introductory,,https://www.edx.org/course/ap-computer-science-java-programming-purduex-cs180-3x
973,973,The Journey of Writing and Scripts in Egypt,"Uncover the multiple and diverse history of writing and scripts in Egypt and reflect on multilingualism, cultural diversity and plurality.",BAx,History,FREE,4 weeks,2 hours per week,Introductory,None,https://www.edx.org/course/journey-writing-scripts-egypt-bax-bax3
974,974,Implementing Customer Insights for Your Business,"This course teaches how to put customer insights, like those from contextmapping, to work for innovation or marketing in your company.",DelftX,Design,250,4 weeks,3-4 hours per week,Intermediate,Missing,https://www.edx.org/course/implementing-customer-insights-business-delftx-idemc-1x-0
975,975,Molecular Biology - Part 1: DNA Replication and Repair,An in-depth adventure through DNA replication and repair to strengthen your scientific thinking and experimental design skills.,MITx,Biology & Life Sciences,FREE,8 weeks,4-6 hours per week,Advanced,,https://www.edx.org/course/molecular-biology-part-1-dna-replication-mitx-7-28-1x
976,976,System Design for Supply Chain Management and Logistics,"Learn how leading supply chains are designed, what makes them competitive and how to use the SCOR model for analysis to increase your businessÛªs ROI.",ChalmersX,Business & Management,FREE,6 weeks,4-5 hours per week,Introductory,None,https://www.edx.org/course/system-design-supply-chain-management-chalmersx-chm005x
977,977,Communication Acoustics,Learn about the various ways we hear and perceive sound and how to improve technology and products for better communication.,RWTHx,Engineering,FREE,14 weeks,6-8 hours per week,Intermediate,"The course assumes basic knowledge of the fundamentals of signals and systems such as linearity, time invariance, the Fourier transform, and digital filters.",https://www.edx.org/course/communication-acoustics-rwthx-ca101
978,978,Computation Structures 2: Computer Architecture,Learn the basic principles of computer architecture in this interactive computer science course from MIT.,MITx,Computer Science,FREE,10 weeks,6 hours per week,Introductory,"MITx 6.004.1x Computation Structures 1: Digital Circuits, or experience with designing circuits using digital logic gates.",https://www.edx.org/course/computation-structures-2-computer-mitx-6-004-2x
979,979,Statistics for Business - II,"Examine data drawn from allied fields of business such as Finance and HR, and learn how to simulate data to follow a specified distribution.",IIMBx,Business & Management,FREE,7 weeks,5-7 hours per week,Intermediate,Basic Algebra and some Calculus,https://www.edx.org/course/statistics-business-ii-iimbx-qm101-2x-0
980,980,Hospitality and Tourism in China: A Global Perspective,"Learn how China and Chinese travelers play an important role in the global tourism and hospitality sector, and prepare for your first trip to China.",HKPolyUx,Business & Management,FREE,6 weeks,2-3 hours per week,Introductory,Missing,https://www.edx.org/course/hospitality-tourism-china-global-hkpolyux-shtm001x
981,981,Big Bang and the Origin of Chemical Elements,Discover the ultimate origin of all chemical elements essential for life. Explore the Big Bang through Nobel Lectures and scientific papers in part 2 of Life in the Universe.,SNUx,Chemistry,FREE,4 weeks,4-5 hours per week,Introductory,Missing,https://www.edx.org/course/big-bang-origin-chemical-elements-snux-snum1409-000300-2x
982,982,A Resilient Future: Science and Technology for Disaster Risk Reduction,Discover how science and technology help us reduce disaster risk and increase resilience.,EPFLx,Science,FREE,7 weeks,2-4 hours per week,Advanced,,https://www.edx.org/course/resilient-future-science-technology-epflx-tech4drr
983,983,Data Analytics in Health ÛÒ From Basics to Business,"Improve diagnostics, care and curing by effectively applying data analytics in healthcare and spot entrepreneurial opportunities.",KULeuvenX,Medicine,FREE,4 weeks,2-3 hours per week,Intermediate,None,https://www.edx.org/course/data-analytics-health-basics-business-kuleuvenx-dahx
984,984,Computer Systems Design for Energy Efficiency,"Learn how to design modern computers to improve the speed, performance and energy efficiency of your programs.",ChalmersX,Computer Science,FREE,6 weeks,4-5 hours per week,Intermediate,This course addresses students/professionals with a general understanding of programming computers at low level but with no prior knowledge of how a computer works.,https://www.edx.org/course/computer-systems-design-energy-chalmersx-chm007x
985,985,Behavioral Medicine: A Key to Better Health,Learn how to change everyday behaviors for healthier lives using basic behavioral medicine concepts. Test yourself with virtual patient scenarios.,KIx,Biology & Life Sciences,FREE,6 weeks,30-40 hours,Introductory,None,https://www.edx.org/course/behavioral-medicine-key-better-health-kix-kibehmedx-1
986,986,Graphene Science and Technology,"Learn about the revolutionary 2-D material ÛÒ graphene ÛÒ its practical and electronic applications, and how it offers new insights into quantum physics.",ChalmersX,Electronics,FREE,8 weeks,6 hours per week,Advanced,In order to benefit fully from this course you should have an adequate knowledge of general physics and university level mathematics. ,https://www.edx.org/course/graphene-science-technology-chalmersx-chm001x
987,987,Introduction to Economics: Macroeconomics,"Learn how a national economy works, including the determination of equilibrium levels of national income and prices",SNUx,Economics & Finance,FREE,6 weeks,4-5 hours per week,Introductory,Missing,https://www.edx.org/course/introduction-economics-macroeconomics-snux-snu044-088-2x
988,988,US Voting Access and Fraud,"Political scientists, journalists and election officials explain the storied history of US voting rights and explore access and fraud in 2016.",DavidsonX,Social Sciences,FREE,2 weeks,1 hour per week,Introductory,None.,https://www.edx.org/course/us-voting-access-fraud-davidsonx-davnowxvoting
989,989,Origins of the Human Mind,"Learn about the evolutionary origins of the human mind by comparing our cognitive features to chimpanzees, our closest living relative.",KyotoUx,Science,FREE,5 weeks,2-3 hours per week,Introductory,None,https://www.edx.org/course/origins-human-mind-kyotoux-007x
990,990,The Iterative Innovation Process,Experience the iterative innovation process and learn how you can use this process to develop your own innovative ideas.,MITx,Business & Management,FREE,8 weeks,4-6 hours per week,Introductory,,https://www.edx.org/course/iterative-innovation-process-mitx-3-086x
991,991,New Trends in Trade Agreements in Latin America & the Caribbean,Learn how trade agreements work and what they mean for governments and businesses in Latin America and the Caribbean.,IDBx,Business & Management,FREE,6 weeks,8-10 hours per week,Intermediate,None,https://www.edx.org/course/new-trends-trade-agreements-latin-idbx-idb5-1x
992,992,Chinese Thought: Ancient Wisdom Meets Modern Science - Part 2,"An introduction to early Chinese thought, exploring connections with Western philosophy, spirituality, mindfulness, modern science and everyday life. ",UBCx,Art & Culture,FREE,5 weeks,4-6 hours per week,Introductory,None,https://www.edx.org/course/chinese-thought-ancient-wisdom-meets-ubcx-china300-2x-1
993,993,Global Business in Practice,"Get an overall view of the increasingly complex challenges of global business from the insights, perspectives and experience of Georgetown faculty and senior executives currently working in multinational companies.",GeorgetownX,Business & Management,FREE,6 sections,2-3 hours per section,Advanced,None,https://www.edx.org/course/global-business-practice-georgetownx-gbex-650-01x
994,994,AP Computer Science A: Java Programming Data Structures and Loops,"Learn about repetition statements, data structures, methods and recursion in Java, as you prepare for the AP Computer Science A exam.",PurdueX,Computer Science,FREE,6 weeks,4-6 hours per week,Introductory,,https://www.edx.org/course/ap-computer-science-java-programming-purduex-cs180-2x
995,995,Cyber Security Economics,"Learn how to make better decisions about security and IT by using state-of-the-art economic tools, security metrics and data analytics.",DelftX,Computer Science,FREE,10 weeks,2-4 hours per week,Intermediate,None. Familiarity with basic concepts of information security is recommended.,https://www.edx.org/course/cyber-security-economics-delftx-secon101x
996,996,Ethics of Sports: Do Sports Morally Matter?,"Explore ethical issues in sports, including the value of winning, violence in sports, and intercollegiate athletics and their impact on education.",HamiltonX,Philosophy & Ethics,FREE,2 weeks,3-4 hours per week,Introductory,None,https://www.edx.org/course/ethics-sports-do-sports-morally-matter-hamiltonx-phil108x
997,997,Measuring Health Outcomes in Field Surveys,This course explores the fundamentals of field-based health research through documentary-style learning at ongoing research projects in India and Kenya.,MITx,Health & Safety,FREE,8 weeks,3-4 hours per week,Introductory,"Although not required, prior familiarity with basic public health and statistical concepts is recommended.",https://www.edx.org/course/measuring-health-outcomes-field-surveys-mitx-jpal350x
998,998,"Personal Finance, Part 1: Investing in Yourself",Learn how to incorporate financial considerations into your life decisions and become an effective consumer of financial information.,WellesleyX,Economics & Finance,FREE,7 weeks,4-5 hours per week,Introductory,,https://www.edx.org/course/personal-finance-part-1-investing-wellesleyx-pfinan101x-0
999,999,eHealth ÛÒ Opportunities and Challenges,An introduction to the eHealth field featuring practical examples.,KIx,Computer Science,FREE,6 weeks,5-6 hours per week,Introductory,"None; some experience with the health sector either as patient, care professional, IT and healthcare manager or policy maker is an advantage.",https://www.edx.org/course/ehealth-opportunities-challenges-kix-kiehealthx-1
1000,1000,User Experience (UX) Design: Human Factors and Culture in Design | ¨_¨Á_ã¼¼ÝÊü_¾ÐàÎÐ,"Learn user experience and user interface design-key skills to succeed as a product manager, developer and designer. ¾ÏÂø_¬Ü¡ _¾ä÷¼_¨_ªÉ_ã¨_¨Á¾Áö_ÜÕÎ¾Ïä¦£_ã¾ÐàÎÐ_¡±Á_Î_¥ø___ÓÙÈ_¾ÐàÎÐ_ã¤ ¤ÕÀÓ¬¼¼ÝÊ___ãÙ´ø ÕÎ¾Ð_¾_¥ ¤£ÈÛ_ö¾÷øÈ´Ó¬¾öáü¼ü_ÀÄ_ã¨_¨Á Àµ_Î¾_Î¾Á¤Ô___ã¨_¨ÁÕÎøã_¡¾Ð_¾_¥    ",TsinghuaX,Art & Culture,FREE,7 weeks,3 hours per week,Advanced,"Engineering, design, information, communication related major can take this course.",https://www.edx.org/course/user-experience-ux-design-human-factors-tsinghuax-70167012x-0
1001,1001,Strategy and the Sustainable Enterprise,Learn how sustainability issues influence corporate strategy and how corporations may transform these challenges into sources of competitive advantage.,IIMBx,Business & Management,FREE,5 weeks,5-6 hours per week,Intermediate,,https://www.edx.org/course/strategy-sustainable-enterprise-iimbx-st250x-0
1002,1002,Freedom of Expression in the Age of Globalization,"Freedom of Expression is at the heart of many global controversies and challenges. Learn about the scope, limits and abuses of this fundamental human right.",ColumbiaX,Law,FREE,6 weeks,4-6 hours per week,Intermediate,Basic understanding of and interest in international human rights law,https://www.edx.org/course/freedom-expression-age-globalization-columbiax-foe1x
1003,1003,Fundamentals of Manufacturing Processes,"Learn the technologies used to manufacture products we use every day, and the fundamental principles required to take processes to scale.",MITx,Engineering,FREE,10 weeks,4-6 hours per week,Intermediate,,https://www.edx.org/course/fundamentals-manufacturing-processes-mitx-2-008x
1004,1004,Introduction to Italian Opera,Explore Italian Opera in this two-act learning experience as we learn to listen to music in new ways.,DartmouthX,Music,FREE,6 weeks,3-4 hours per week,Introductory,None,https://www.edx.org/course/introduction-italian-opera-dartmouthx-dart-mus-01x-0
1005,1005,Quantum Cryptography,Learn how quantum communication provides security that is guaranteed by the laws of nature.,CaltechX,Computer Science,FREE,10 weeks,6 to 8 hours per week,Advanced,,https://www.edx.org/course/quantum-cryptography-caltechx-delftx-qucryptox
1006,1006,Design and Development of Games for Learning,"This project-based course explores the process of designing and developing educational games, including issues associated with assessment, implementation and marketing.",MITx,Education & Teacher Training,FREE,9 weeks,6-10 hours per week,Introductory,,https://www.edx.org/course/design-development-games-learning-mitx-11-127x-0
1007,1007,Introduction to Systems Biology,Learn how to model and simulate complex and dynamic behavior in biological systems.,IEEEx,Biology & Life Sciences,FREE,4 weeks,1-3 hours per week,Introductory,,https://www.edx.org/course/introduction-systems-biology-ieeex-sysbio1x-0
1008,1008,Oriental Beliefs: Between Reason and Traditions,"Explore the spiritual and magical beliefs of cultures, from ancient Egypt to modern Japan, as we discuss gods, the universe, cosmos, dreams and so much more!",LouvainX,Humanities,FREE,8 weeks,2-3 hours per week,Introductory,"No prerequisite in particular, but a strong curiosity and interest in foreign cultures is definitely a must.",https://www.edx.org/course/oriental-beliefs-between-reason-louvainx-louv19x
1009,1009,Nanophotonic Modeling,Learn a comprehensive set of simulation techniques to predict the performance of photonic nanostructures.,PurdueX,Engineering,FREE,8 weeks,3-4 hours per week,Advanced,,https://www.edx.org/course/nanophotonic-modeling-purduex-nano540x
1010,1010,Effective Thinking Through Mathematics,Learn tools of effective thinking through puzzles and mathematics in this fun and fascinating course.,UTAustinX,Math,FREE,4 weeks,2-5 hours per week,Introductory,,https://www.edx.org/course/effective-thinking-through-mathematics-utaustinx-ut-9-01x-0
1011,1011,Engineering Mechanics,Learn about statics through real life engineering examples. Engage with the theory to grasp the full understanding of simple machines and complex mathematical models.,UrFUx,Physics,FREE,9 weeks,2-3 hours per week,Intermediate,"Learners should know secondary school mathematics, as well as the ÛÏMechanicsÛ section from Physics. They should have a developed spatial awareness and be able to use a scientific calculator.",https://www.edx.org/course/engineering-mechanics-urfux-engm1-1-x
1012,1012,"The Divine Comedy: Dante's Journey to Freedom, Part 2 (Purgatorio)","After his harrowing descent into the depths of despair, the Pilgrim Dante emerges with Virgil onto the Isle of Mount Purgatorio in the southern hemisphere. There he will be healed of sin and prepared for his climactic reunion with Beatrice.",GeorgetownX,Humanities,FREE,7 weeks,8-10 hours per week,Introductory,None,https://www.edx.org/course/divine-comedy-dantes-journey-freedom-georgetownx-humx422-02x
1013,1013,JuryX: Deliberations for Social Change,"Deliberate emotionally charged issues with your peers online without fear or rancor, and experience a system by which a jury, or any community, can move from a place of deep division to agreement and action.",HarvardX,Law,FREE,7 weeks,2-3 hours per week,Introductory,None,https://www.edx.org/course/juryx-deliberations-social-change-harvardx-hls3x-0
1014,1014,Mathematical Modeling in Biology and Life Sciences ÓÙä©¾¥¡__È¼¾¬Á,___Ê_ÀÓ¬¾¥¡__È¼¾¬Á_ã¾Ð_¾_¥_¦Û_Àà¨_àÕÎ¨_¾Û¤ö ¾_¾¬Á_Ü¾Ý«´_Ï¡ ¤£ÓÙä©_¡±ÁÛâLearn to use mathematical models to gain a better understanding of biological processes through both qualitative and quantitative analysis.,PekingX,Biology & Life Sciences,FREE,10 weeks,3-4 hours per week,Introductory,CalculusWorking knowledge of Linear AlgebraÇ÷¾¥¡Ù¼ÁÛ¼À¾Û¤È£¾¥¡,https://www.edx.org/course/mathematical-modeling-biology-life-pekingx-01139732x-0
1015,1015,Exploring HumansÛª Space: An Introduction to Geographicity,"Explore how geography, cartography, urbanization and spatial justice play a role in shaping the notion of human space.",EPFLx,Social Sciences,FREE,10 weeks,4 hours per week,Introductory,None,https://www.edx.org/course/exploring-humans-space-introduction-epflx-spacex-0
1016,1016,Software Construction in Java,"Learn how to write programs that are safe from bugs, easy to understand, and ready for change.",MITx,Computer Science,FREE,12 weeks,15 hours per week,Intermediate,"Programming experience equivalent to Introduction to Computer Science and Programming Using Python 6.00.1x is required, with a working knowledge of a modern programming language like Python or Javascript or Java. The course will use Java for all assignments, but will include Java tutorial elements if you don't know Java yet.",https://www.edx.org/course/software-construction-java-mitx-6-005-1x
1017,1017,A Global History of Architecture,"Learn about humanityÛªs rich architectural history on this journey around the globe ÛÒ from 100,000 BCE to ca. 1,600 CE.",MITx,History,FREE,12 weeks,6 hours per week,Introductory,Missing,https://www.edx.org/course/global-history-architecture-mitx-4-605x
1018,1018,Entrepreneurial Opportunities,Learn how to be a successful entrepreneur by understanding how to evaluate business opportunities and ideas.,AdelaideX,Business & Management,FREE,5 weeks,2-3 hours per week,Introductory,None,https://www.edx.org/course/entrepreneurial-opportunities-adelaidex-entrep101x
1019,1019,Computational Probability and Inference,"Learn fundamentals of probabilistic analysis and inference. Build computer programs that reason with uncertainty and make predictions. Tackle machine learning problems, from recommending movies to spam filtering to robot navigation.",MITx,Data Analysis & Statistics,FREE,12 weeks,4-6 hours per week,Intermediate,,https://www.edx.org/course/computational-probability-inference-mitx-6-008-1x
1020,1020,Preparing for the AP Physics 1 Exam,Prepare for the AP Physics 1 exam in this engaging and interactive prep course from Boston University.,BUx,Physics,FREE,34 weeks,6 hours per week,Introductory,"Basic algebra, geometry, and trigonometry. Previous conceptual physics understanding helpful but not required.",https://www.edx.org/course/preparing-ap-physics-1-exam-bux-py1x
1021,1021,Statistics for Business ÛÒ I,This introduction to statistics course examines data from the perspective of business scenarios and demonstrates how to apply this data to make better decisions.  ,IIMBx,Business & Management,FREE,5 weeks,5-7 hours per week,Intermediate,Basic Algebra and some Calculus,https://www.edx.org/course/statistics-business-i-iimbx-qm101-1x-0
1022,1022,Introduction to Solid State Chemistry,Learn chemical principles by examining materials with examples from energy generation and storage to emerging technologies.,MITx,Chemistry,FREE,15 weeks,12 hours per week,Introductory,,https://www.edx.org/course/introduction-solid-state-chemistry-mitx-3-091x-4
1023,1023,Optimization Methods for Business Analytics,Learn how to use optimization methodologies and modeling approaches to effectively analyze data.,MITx,Math,FREE,6 weeks,6-8 hours per week,Introductory,"None, although a comfort with mathematics is expected.",https://www.edx.org/course/optimization-methods-business-analytics-mitx-15-053x
1024,1024,Computation Structures - Part 1: Digital Circuits,Learn the fundamentals of digital circuit design in this interactive computer science course from MIT.,MITx,Computer Science,FREE,10 weeks,6 hours per week,Introductory,,https://www.edx.org/course/computation-structures-part-1-digital-mitx-6-004-1x-0
1025,1025,Chinese Thought: Ancient Wisdom Meets Modern Science - Part 1,"An introduction to early Chinese thought, exploring connections with Western philosophy, spirituality, mindfulness, modern science and everyday life. ",UBCx,Art & Culture,FREE,5 weeks,4-6 hours per week,Introductory,None,https://www.edx.org/course/chinese-thought-ancient-wisdom-meets-ubcx-china300-1x-1
1026,1026,"Jazz: The Music, The Stories, The Players","Learn whatÛªs unique about jazz (swing, improvisation, structure and expression) and get an insiderÛªs view from celebrated jazz musicians.",HamiltonX,Music,FREE,6 weeks,3-4 hours per week,Introductory,None,https://www.edx.org/course/jazz-music-stories-players-hamiltonx-music160x-0
1027,1027,AP Computer Science A: Java Programming,"Learn about basic computer operation, variables, and selection statements in Java as you prepare for the AP Computer Science A exam.",PurdueX,Computer Science,FREE,6 weeks,4-6 hours per week,Introductory,Secondary school algebra,https://www.edx.org/course/ap-computer-science-java-programming-purduex-cs180-1x
1028,1028,Introduction to Aerospace Engineering: Astronautics and Human Spaceflight,"Spaceflight is exciting, and you donÛªt have to be a ÛÏRocket ScientistÛ to share in the excitement! 16.00x makes the basics of spaceflight accessible to everyone.",MITx,Engineering,FREE,8 weeks,3 hours per week,Introductory,"Some lectures use high school level physics and basic calculus, but most of the course is accessible to the general public without specialized background.",https://www.edx.org/course/introduction-aerospace-engineering-mitx-16-00x-0
1029,1029,"Reliable Distributed Algorithms, Part 1","This course gives a comprehensive introduction to the theory and practice of distributed algorithms for designing scalable, reliable services.",KTHx,Computer Science,FREE,5 weeks,5 hours per week,Advanced,,https://www.edx.org/course/reliable-distributed-algorithms-part-1-kthx-id2203-1x
1030,1030,Agile Software Development,Learn fundamental agile concepts to enhance your software development skills.,ETHx,Computer Science,FREE,6 weeks,2-3 hours per week,Introductory,None,https://www.edx.org/course/agile-software-development-ethx-asd-1x
1031,1031,"Financial Programming and Policies, Part 2: Program Design",Learn how to forecast macroeconomic accounts and design an economic program for a case study country.,IMFx,Economics & Finance,FREE,7 weeks,6-8 hours per week,Intermediate,"Prior knowledge or completion of Financial Programming and Policies, Part 1 is recommended.",https://www.edx.org/course/financial-programming-policies-part-2-imfx-fpp-2x
1032,1032,Humanitarian Response to Conflict and Disaster,"Learn the principles guiding humanitarian response to modern emergencies, and the challenges faced in the field today.",HarvardX,Health & Safety,FREE,5 weeks,3-4 hours per week,Introductory,Missing,https://www.edx.org/course/humanitarian-response-conflict-disaster-harvardx-ph558x
1033,1033,Sustainability in Everyday Life,"Learn the skills and information required to make more sustainable choices in everyday life related to food, energy, climate change and globalization.",ChalmersX,Environmental Studies,FREE,6 weeks,6 hours per week,Introductory,,https://www.edx.org/course/sustainability-everyday-life-chalmersx-chm002x-0
